{
  "$schema": "http://json-schema.org/draft-07/schema#",
  "$id": "https://github.com/atvardovsky/AlatyrCore/schemas/alatyr-delegation-policy.schema.json",
  "title": "Alatyr target subagent delegation policy",
  "$comment": "Resolved word allocations also impose a measured-character ceiling of 12 times each limit; the shared validator enforces both, including aggregate and recursive budgets.",
  "type": "object",
  "additionalProperties": false,
  "required": [
    "schema_version", "policy_kind", "state", "owner", "decision_mode",
    "default_preference", "max_parallel_delegates",
    "single_depth1_read_only_evidence", "full_tree_required_when", "tree_policy",
    "recursive_child_policy", "context_compaction", "stop_policy",
    "decomposition_policy", "role_catalog", "analysis_strategy_contract",
    "enabled_role_ids", "requirements", "eligible_work", "prohibited_work",
    "retry_policy", "conflict_policy", "result_policy",
    "privacy_and_retention", "validation", "review_triggers"
  ],
  "properties": {
    "schema_version": {"const": 7},
    "policy_kind": {"const": "target-subagent-delegation-policy"},
    "state": {"type": "string", "minLength": 1},
    "owner": {"type": "string", "minLength": 1},
    "decision_mode": {"type": "string", "minLength": 1},
    "default_preference": {"type": "string", "minLength": 1},
    "max_parallel_delegates": {"$ref": "#/definitions/delegateLimit"},
    "single_depth1_read_only_evidence": {"const": "lightweight-receipt"},
    "full_tree_required_when": {
      "const": ["multiple-workers", "depth-two", "write-scope", "retry", "child-proposals", "semantic-overlap"]
    },
    "tree_policy": {
      "type": "object",
      "additionalProperties": false,
      "required": [
        "dispatch_owner", "worker_child_behavior", "default_max_depth",
        "hard_max_depth", "max_total_delegates", "max_children_per_parent",
        "max_context_words_total", "max_retries_total",
        "require_disjoint_coverage_keys"
      ],
      "properties": {
        "dispatch_owner": {"const": "primary-assistant"},
        "worker_child_behavior": {
          "anyOf": [
            {"enum": ["propose-only", "primary-preauthorized-read-only"]},
            {"$ref": "#/definitions/placeholder"}
          ]
        },
        "default_max_depth": {"const": 1},
        "hard_max_depth": {
          "anyOf": [
            {"type": "integer", "minimum": 1, "maximum": 2},
            {"$ref": "#/definitions/placeholder"}
          ]
        },
        "max_total_delegates": {"$ref": "#/definitions/delegateLimit"},
        "max_children_per_parent": {"$ref": "#/definitions/childLimit"},
        "max_context_words_total": {"$ref": "#/definitions/contextLimit"},
        "max_retries_total": {"$ref": "#/definitions/retryLimit"},
        "require_disjoint_coverage_keys": {"const": true}
      }
    },
    "recursive_child_policy": {
      "type": "object",
      "additionalProperties": false,
      "required": [
        "require_verified_nested_capability", "require_primary_branch_envelope",
        "allowed_actions", "write_scope", "must_narrow_parent_scope", "escalation"
      ],
      "properties": {
        "require_verified_nested_capability": {"const": true},
        "require_primary_branch_envelope": {"const": true},
        "allowed_actions": {"const": ["inspect"]},
        "write_scope": {"const": "none"},
        "must_narrow_parent_scope": {"const": true},
        "escalation": {"const": "return-to-primary"}
      }
    },
    "context_compaction": {
      "type": "object",
      "additionalProperties": false,
      "required": [
        "mode", "raw_result_loading", "summary_propagation", "digest_algorithm",
        "require_measured_result_artifacts", "deduplicate_inherited_context",
        "max_result_words_total", "max_primary_summary_words_total"
      ],
      "properties": {
        "mode": {"const": "hierarchical-summary"},
        "raw_result_loading": {"const": "reference-only-unless-review-triggered"},
        "summary_propagation": {"const": "accepted-summary-only"},
        "digest_algorithm": {"const": "sha256"},
        "require_measured_result_artifacts": {"const": true},
        "deduplicate_inherited_context": {"const": true},
        "max_result_words_total": {"$ref": "#/definitions/resultLimit"},
        "max_primary_summary_words_total": {"$ref": "#/definitions/summaryLimit"}
      }
    },
    "stop_policy": {
      "type": "object",
      "additionalProperties": false,
      "required": ["require_stop_reason", "evidence_saturation", "stop_reason_ids"],
      "properties": {
        "require_stop_reason": {"const": true},
        "evidence_saturation": {"const": "stop-when-acceptance-required-evidence-and-assigned-proof-obligations-are-covered"},
        "stop_reason_ids": {
          "type": "array",
          "minItems": 20,
          "uniqueItems": true,
          "items": {"type": "string", "minLength": 1}
        }
      }
    },
    "decomposition_policy": {"const": ".ai/assistant/task-decomposition.json"},
    "role_catalog": {"const": ".ai/assistant/workers/role-catalog.json"},
    "analysis_strategy_contract": {
      "type": "object",
      "additionalProperties": false,
      "required": ["primary_selection_owner", "worker_scope", "waiver_authority", "completion_owner"],
      "properties": {
        "primary_selection_owner": {"const": "primary-assistant"},
        "worker_scope": {"const": "assigned-proof-obligations-only"},
        "waiver_authority": {"const": "primary-assistant-with-target-authorization"},
        "completion_owner": {"const": "primary-assistant"}
      }
    },
    "enabled_role_ids": {"type": "array", "minItems": 1, "items": {"type": "string", "minLength": 1}},
    "requirements": {"type": "object"},
    "eligible_work": {"type": "array", "minItems": 1},
    "prohibited_work": {"type": "array", "minItems": 1},
    "retry_policy": {"type": "object"},
    "conflict_policy": {"type": "object"},
    "result_policy": {"type": "object"},
    "privacy_and_retention": {"type": "string", "minLength": 1},
    "validation": {"type": "array", "minItems": 1},
    "review_triggers": {"type": "array", "minItems": 1}
  },
  "definitions": {
    "placeholder": {"type": "string", "pattern": "^\\{[A-Z0-9_]+\\}$"},
    "nonzeroLimit": {
      "anyOf": [
        {"type": "integer", "minimum": 1},
        {"$ref": "#/definitions/placeholder"}
      ]
    },
    "delegateLimit": {
      "anyOf": [
        {"type": "integer", "minimum": 1, "maximum": 8},
        {"$ref": "#/definitions/placeholder"}
      ]
    },
    "childLimit": {
      "anyOf": [
        {"type": "integer", "minimum": 1, "maximum": 4},
        {"$ref": "#/definitions/placeholder"}
      ]
    },
    "contextLimit": {
      "anyOf": [
        {"type": "integer", "minimum": 1, "maximum": 32000},
        {"$ref": "#/definitions/placeholder"}
      ]
    },
    "resultLimit": {
      "anyOf": [
        {"type": "integer", "minimum": 1, "maximum": 12000},
        {"$ref": "#/definitions/placeholder"}
      ]
    },
    "summaryLimit": {
      "anyOf": [
        {"type": "integer", "minimum": 1, "maximum": 4000},
        {"$ref": "#/definitions/placeholder"}
      ]
    },
    "retryLimit": {
      "anyOf": [
        {"type": "integer", "minimum": 0, "maximum": 2},
        {"$ref": "#/definitions/placeholder"}
      ]
    },
    "nonnegativeLimit": {
      "anyOf": [
        {"type": "integer", "minimum": 0},
        {"$ref": "#/definitions/placeholder"}
      ]
    }
  }
}
