{
  "schema_version": 7,
  "policy_kind": "target-subagent-delegation-policy",
  "state": "{ENABLED_SUGGEST_ONLY_DISABLED_OR_BLOCKED}",
  "owner": "{TARGET_DELEGATION_POLICY_OWNER}",
  "decision_mode": "{AUTOMATIC_SUGGEST_ONLY_OR_DISABLED}",
  "default_preference": "{AUTO_ALLOW_FORBID_OR_REQUIRE_SUPPORTED}",
  "max_parallel_delegates": "{POSITIVE_INTEGER_OR_TARGET_LIMIT}",
  "single_depth1_read_only_evidence": "lightweight-receipt",
  "full_tree_required_when": [
    "multiple-workers",
    "depth-two",
    "write-scope",
    "retry",
    "child-proposals",
    "semantic-overlap"
  ],
  "tree_policy": {
    "dispatch_owner": "primary-assistant",
    "worker_child_behavior": "{PROPOSE_ONLY_OR_PRIMARY_PREAUTHORIZED_READ_ONLY}",
    "default_max_depth": 1,
    "hard_max_depth": "{ONE_OR_TWO_NOT_ABOVE_PORTABLE_HARD_LIMIT}",
    "max_total_delegates": "{POSITIVE_INTEGER_OR_TARGET_LIMIT}",
    "max_children_per_parent": "{POSITIVE_INTEGER_OR_TARGET_LIMIT}",
    "max_context_words_total": "{POSITIVE_INTEGER_OR_TARGET_LIMIT}",
    "max_retries_total": "{POSITIVE_INTEGER_OR_ZERO}",
    "require_disjoint_coverage_keys": true
  },
  "recursive_child_policy": {
    "require_verified_nested_capability": true,
    "require_primary_branch_envelope": true,
    "allowed_actions": ["inspect"],
    "write_scope": "none",
    "must_narrow_parent_scope": true,
    "escalation": "return-to-primary"
  },
  "context_compaction": {
    "mode": "hierarchical-summary",
    "raw_result_loading": "reference-only-unless-review-triggered",
    "summary_propagation": "accepted-summary-only",
    "digest_algorithm": "sha256",
    "require_measured_result_artifacts": true,
    "deduplicate_inherited_context": true,
    "max_result_words_total": "{POSITIVE_INTEGER_OR_TARGET_LIMIT}",
    "max_primary_summary_words_total": "{POSITIVE_INTEGER_OR_TARGET_LIMIT}"
  },
  "stop_policy": {
    "require_stop_reason": true,
    "evidence_saturation": "stop-when-acceptance-required-evidence-and-assigned-proof-obligations-are-covered",
    "stop_reason_ids": [
      "scope-covered",
      "evidence-sufficient",
      "coordination-cost-exceeds-benefit",
      "maximum-depth-reached",
      "worker-budget-reached",
      "context-budget-reached",
      "result-budget-reached",
      "primary-context-budget-reached",
      "checkpoint-required",
      "checkpoint-invalid",
      "context-digest-stale",
      "evidence-digest-mismatch",
      "branch-envelope-violation",
      "validation-regression",
      "semantic-decision-required",
      "overlapping-scope",
      "primary-critical-path",
      "capability-unavailable",
      "user-restricted",
      "cancelled-by-primary"
    ]
  },
  "decomposition_policy": ".ai/assistant/task-decomposition.json",
  "role_catalog": ".ai/assistant/workers/role-catalog.json",
  "analysis_strategy_contract": {
    "primary_selection_owner": "primary-assistant",
    "worker_scope": "assigned-proof-obligations-only",
    "waiver_authority": "primary-assistant-with-target-authorization",
    "completion_owner": "primary-assistant"
  },
  "enabled_role_ids": [
    "{TARGET_ENABLED_WORKER_ROLE_ID}"
  ],
  "requirements": {
    "primary_keeps_critical_path": true,
    "independent_local_acceptance": true,
    "disjoint_write_scope": true,
    "primary_final_convergence": true,
    "current_capability_evidence": true
  },
  "eligible_work": [
    "{TARGET_BOUNDED_ELIGIBLE_WORK_CLASS}"
  ],
  "prohibited_work": [
    "unresolved business rules or semantic invariants",
    "architecture or source-of-truth decisions",
    "approval or decision authority",
    "security permissions credentials destructive production spend migration or external-effect work",
    "overlapping write scopes or final convergence",
    "{TARGET_ADDITIONAL_PROHIBITED_WORK}"
  ],
  "retry_policy": {
    "max_attempts_per_task": "{POSITIVE_INTEGER_OR_ZERO}",
    "retry_only_when_scope_unchanged": true,
    "retryable_outcomes": [
      "transient dispatch failure",
      "bounded validation failure with a known local repair",
      "{TARGET_RETRYABLE_OUTCOME_OR_NONE}"
    ],
    "non_retryable_outcomes": [
      "authorization capability or approval failure",
      "scope dependency semantic or architecture expansion",
      "repeated identical failure",
      "{TARGET_NON_RETRYABLE_OUTCOME_OR_NONE}"
    ]
  },
  "conflict_policy": {
    "overlapping_writes": "reject-concurrent-dispatch",
    "contradictory_results": "return-to-primary",
    "stale_baseline": "revalidate-before-integration",
    "scope_violation": "reject-result"
  },
  "result_policy": {
    "accept_out_of_scope_changes": false,
    "accept_unvalidated_changes": false,
    "require_primary_review": true,
    "require_actual_model_or_unverified_status": true,
    "require_normalized_worker_result": true,
    "require_hash_bound_summary": true,
    "require_branch_checkpoint_for_recursive_work": true
  },
  "privacy_and_retention": "{TARGET_PACKET_AND_RESULT_PRIVACY_RETENTION_POLICY}",
  "validation": [
    "{TARGET_DELEGATION_POLICY_VALIDATION_OR_MANUAL_REVIEW}"
  ],
  "review_triggers": [
    "assistant client or model availability changed",
    "tool permission or write-isolation behavior changed",
    "delegated work caused rework validation failure or scope drift",
    "{TARGET_DELEGATION_POLICY_REVIEW_TRIGGER}"
  ]
}
